{
  "version": 1,
  "id": "S-2026-10-20-1",
  "agent": "timonier-init",
  "objective": "Initialise Timonier",
  "tasks": [
    "T-1"
  ],
  "status": "ended",
  "started_at": "2026-10-20T09:46:18Z",
  "ended_at": "2026-10-20T09:46:19Z",
  "snapshots": {
    "start": 2,
    "end": 3
  },
  "summary": "Timonier configured by timonier init: the agents' instructions, the MCP server, the hooks.",
  "todo": [
    {
      "id": "D-1",
      "text": "Configure the agents, the MCP server and the hooks",
      "task": "T-1",
      "status": "done"
    }
  ],
  "changes": {
    "files": 0,
    "added": [],
    "modified": [],
    "removed": [],
    "linked": [],
    "unlinked": []
  }
}
