{
  "version": 1,
  "id": "S-2026-10-21-5",
  "agent": "claude-code",
  "objective": "Fix the macOS CI failure: the blocking client failed with EINVAL reading the answer of a socket the daemon had closed (d1a0d48); record Q70, Q71 and the Phase 8 dependency check in PLAN.md",
  "status": "ended",
  "started_at": "2026-10-21T09:32:09Z",
  "ended_at": "2026-10-21T09:32:09Z",
  "snapshots": {
    "start": 32,
    "end": 33
  },
  "summary": "macOS fix committed and pushed (d1a0d48): the blocking client reads anyway when macOS refuses the read timeout on a closed socket. PLAN.md: Q70 (fall back to CPU time, doctor gives the sysctl), Q71 (Phase 8 exit criterion validated), dependencies verified for Phase 8 (junit-parser instead of quick-junit, statrs exact Mann-Whitney wrong, tracing-opentelemetry has no code.function.name). Left: Phase 8.",
  "changes": {
    "files": 0,
    "added": [],
    "modified": [],
    "removed": [],
    "linked": [],
    "unlinked": []
  }
}
