{
  "version": 1,
  "id": "S-2026-10-21-13",
  "agent": "claude-code",
  "objective": "8.8: performance budgets of the whiteboard compared with the median of several runs; overruns in red on the map and in the journal; MCP tools get_budgets, get_budget_violations, get_perf",
  "tasks": [
    "T-100"
  ],
  "status": "ended",
  "started_at": "2026-10-21T12:05:15Z",
  "ended_at": "2026-10-21T12:19:45Z",
  "snapshots": {
    "start": 48,
    "end": 49
  },
  "summary": "8.8 done (ADR 0052, Q74, Q75): budgets of the whiteboard checked in timonier-core::budgets (target per attachment, incoming calls, p50/p95 nearest rank, median of the last 5 traced runs); perf/budgets; MCP get_budgets, get_budget_violations, get_perf; the map marks a box holding an exceeded budget, always; session_end keeps the exceeded budgets in the journal, shown in the session's Tests part. Next: 8.9, the regression detection.",
  "changes": {
    "files": 33,
    "added": [],
    "modified": [
      {
        "id": "pkg:npm/@timonier/webview",
        "name": "@timonier/webview",
        "within": null
      },
      {
        "id": "component:cluster/webview/src/App.test.tsx",
        "name": "App",
        "within": "@timonier/webview"
      },
      {
        "id": "component:cluster/webview/src/map/MapView.test.ts",
        "name": "MapView",
        "within": "map"
      },
      {
        "id": "component:dir/webview/src/demo",
        "name": "demo",
        "within": "@timonier/webview"
      },
      {
        "id": "component:dir/webview/src/design",
        "name": "design",
        "within": "@timonier/webview"
      },
      {
        "id": "component:cluster/crates/timonier-daemon/src/client.rs",
        "name": "error",
        "within": "timonier-daemon"
      },
      {
        "id": "component:cluster/editors/vscode/src/extension.ts",
        "name": "extension",
        "within": "timonier"
      },
      {
        "id": "component:cluster/editors/vscode/src/daemon.ts",
        "name": "generated",
        "within": "timonier"
      },
      {
        "id": "component:dir/crates/timonier-cli/src/init",
        "name": "init",
        "within": "timonier-cli"
      },
      {
        "id": "component:dir/webview/src/map",
        "name": "map",
        "within": "@timonier/webview"
      },
      {
        "id": "component:cluster/crates/timonier-core/src/protocol.rs",
        "name": "protocol",
        "within": "timonier-core"
      },
      {
        "id": "component:cluster/webview/src/density.test.ts",
        "name": "protocol",
        "within": "@timonier/webview"
      },
      {
        "id": "component:cluster/crates/timonier-core/src/aggregate.rs",
        "name": "review",
        "within": "timonier-core"
      },
      {
        "id": "component:cluster/crates/timonier-daemon/src/bridge.rs",
        "name": "subscriptions",
        "within": "timonier-daemon"
      },
      {
        "id": "component:dir/crates/timonier-cli/tests",
        "name": "tests",
        "within": "timonier-cli"
      },
      {
        "id": "pkg:npm/timonier",
        "name": "timonier",
        "within": null
      },
      {
        "id": "pkg:cargo/timonier-cli",
        "name": "timonier-cli",
        "within": null
      },
      {
        "id": "pkg:cargo/timonier-core",
        "name": "timonier-core",
        "within": null
      },
      {
        "id": "pkg:cargo/timonier-daemon",
        "name": "timonier-daemon",
        "within": null
      },
      {
        "id": "component:dir/webview/src/tracking",
        "name": "tracking",
        "within": "@timonier/webview"
      },
      {
        "id": "component:cluster/webview/src/host.ts",
        "name": "uiState",
        "within": "@timonier/webview"
      }
    ],
    "removed": [],
    "linked": [
      {
        "from": {
          "id": "component:cluster/crates/timonier-core/src/aggregate.rs",
          "name": "review",
          "within": "timonier-core"
        },
        "to": {
          "id": "component:cluster/crates/timonier-core/src/protocol.rs",
          "name": "protocol",
          "within": "timonier-core"
        }
      }
    ],
    "unlinked": []
  }
}
